id,name,ability,firstNightReminder,firstNightReminderMD,otherNightReminder,otherNightReminderMD,reminders,reminderCopies,firstNight,otherNight,team,sao,edition,setup,tokenCopies
thief,Thief,"Each night, choose a player (not yourself): their vote counts negatively tomorrow.",The Thief chooses a player.,"The Thief chooses a player. <i class=""reminder-token""></i>",The Thief chooses a player.,"The Thief chooses a player. <i class=""reminder-token""></i>",Negative vote,1,8,7,traveler,100,experimental,FALSE,1
tinker,Tinker,You might die at any time.,,,The Tinker might die.,"The Tinker might die. <i class=""reminder-token""></i>",Dead,1,-1,57,outsider,6,bmr,FALSE,1
towncrier,Town Crier,"Each night*, you learn if a Minion nominated today.",,,Either nod or shake your head.,Either nod or shake your head.,"Minions not nominated,Minion nominated","1,1",-1,66,townsfolk,3,snv,FALSE,1
toymaker,Toymaker,The Demon may choose not to attack & must do this at least once per game. Evil players get normal starting info.,Resolve the Minion Info and Demon Info steps even though there are fewer than 7 players.,Resolve the Minion Info and Demon Info steps even though there are fewer than 7 players.,"If it is a night when a Demon attack could end the game, and the Demon is marked ""Final night: No Attack,"" then the Demon does not act tonight. (Do not wake them.)","If it is a night when a Demon attack could end the game, and the Demon is marked <b>Final night: No Attack</b>, then the Demon does not act tonight. (Do not wake them.)",No Attack,1,4,2,fabled,101,experimental,FALSE,1
undertaker,Undertaker,"Each night*, you learn which character died by execution today.",,,"If a player was executed today, show their character token.","If a player was executed today, show their character token.",Executed,1,-1,63,townsfolk,3,tb,FALSE,1
vigormortis,Vigormortis,"Each night*, choose a player: they die. Minions you kill keep their ability & poison 1 Townsfolk neighbour. [−1 Outsider]",,,"The Vigormortis chooses a player. If that player is a Minion, poison a neighboring Townsfolk.","The Vigormortis chooses a player. <i class=""reminder-token""></i> If that player is a Minion, poison a neighboring Townsfolk. <i class=""reminder-token""></i> <i class=""reminder-token""></i>","Dead,Has ability,Poisoned","1,3,3",-1,39,demon,3,snv,TRUE,1
virgin,Virgin,"The 1st time you are nominated, if the nominator is a Townsfolk, they are executed immediately.",,,,,No ability,1,-1,-1,townsfolk,6,tb,FALSE,1
vizier,Vizier,"All players know who you are. You can not die during the day. If good voted, you may choose to execute immediately.",Announce the Vizier player to the group.,Announce the Vizier player to the group.,,,,,67,-1,minion,6,experimental,FALSE,1
vortox,Vortox,"Each night*, choose a player: they die. Townsfolk abilities yield false info. Each day, if no-one is executed, evil wins.",,,The Vortox chooses a player.,"The Vortox chooses a player. <i class=""reminder-token""></i>",Dead,1,-1,38,demon,3,snv,FALSE,1
voudon,Voudon,Only you and the dead can vote. They don't need a vote token to do so. A 50% majority is not required.,,,,,,,-1,-1,traveler,100,experimental,FALSE,1
washerwoman,Washerwoman,You start knowing that 1 of 2 players is a particular Townsfolk.,Show the Townsfolk character token. Point to both the TOWNSFOLK and WRONG players.,Show the Townsfolk character token. Point to both the <b>TOWNSFOLK</b> and <b>WRONG</b> players.,,,"Townsfolk,Wrong","1,1",41,-1,townsfolk,1,tb,FALSE,1
widow,Widow,"On your 1st night, look at the Grimoire and choose a player: they are poisoned. 1 good player knows a Widow is in play.",Show the Grimoire for as long as the Widow needs. The Widow chooses a player.,"Show the Grimoire for as long as the Widow needs. The Widow chooses a player. <i class=""reminder-token""></i>",,,"Poisoned,Knows","1,1",25,-1,minion,1,experimental,FALSE,1
witch,Witch,"Each night, choose a player: if they nominate tomorrow, they die. If just 3 players live, you lose this ability.",The Witch chooses a player.,"The Witch chooses a player. <i class=""reminder-token""></i>",The Witch chooses a player.,"The Witch chooses a player. <i class=""reminder-token""></i>",Cursed,1,31,20,minion,2,snv,FALSE,1
zombuul,Zombuul,"Each night*, if no-one died today, choose a player: they die. The 1st time you die, you live but register as dead.",,,"If no one died today, the Zombuul chooses a player.","If no one died today, the Zombuul chooses a player. <i class=""reminder-token""></i>","Died today,Dead","1,1",-1,32,demon,3,bmr,FALSE,1
dawn,Dawn,,Wait for a few seconds. End the Night Phase.,Wait for a few seconds. End the Night Phase.,Wait for a few seconds. End the Night Phase.,Wait for a few seconds. End the Night Phase.,,,65,81,reminders,102,,FALSE,0
demoninfo,Demon Info,,"If there are 7 or more players, wake the Demon:
Show the THESE ARE YOUR MINIONS token. Point to all Minions.
Show the THESE CHARACTERS ARE NOT IN PLAY token. Show 3 not-in-play good character tokens.","If there are 7 or more players, wake the Demon:
 Show the <b>THESE ARE YOUR MINIONS</b> token. Point to all Minions.
 Show the <b>THESE CHARACTERS ARE NOT IN PLAY</b> token. Show 3 not-in-play good character tokens.",,,,,16,-1,reminders,102,,FALSE,0
dusk,Dusk,,Start the Night Phase.,Start the Night Phase.,Start the Night Phase.,Start the Night Phase.,,,0,0,reminders,102,,FALSE,0
minioninfo,Minion Info,,"If there are 7 or more players, wake all Minions:
Show the THIS IS THE DEMON token. Point to the Demon.
Show the THESE ARE YOUR MINIONS token. Point to the other Minions.","If there are 7 or more players, wake all Minions:
 Show the <b>THIS IS THE DEMON</b> token. Point to the Demon.
 Show the <b>THESE ARE YOUR MINIONS</b> token. Point to the other Minions.",,,,,13,-1,reminders,102,,FALSE,0