id,name,ability,firstNightReminder,firstNightReminderMD,otherNightReminder,otherNightReminderMD,reminders,reminderCopies,firstNight,otherNight,team,sao,edition,setup,tokenCopies
acrobat,Acrobat,"Each night*, if either good living neighbour is drunk or poisoned, you die.",,,The Acrobat might die,The Acrobat might die,Dead,1,-1,47,outsider,3,experimental,FALSE,1
alchemist,Alchemist,You have a not-in-play Minion ability.,Show the YOU ARE token and the character token of a not in play Minion.,Show the <b>YOU ARE</b> token and the character token of a not in play Minion.,,,Is the Alchemist,1,10,-1,townsfolk,6,experimental,FALSE,1
alhadikhia,Al-Hadikhia,"Each night*, choose 3 players (all players learn who): each silently chooses to live or die, but if all live, all die.",,,"The Al-Hadikhia chooses three players. Wake the player marked 1 and say ""the Al-Hadikhia has chosen"", then the player's name, then ""Do you choose to live?"" They either nod or shake their head. Put them to sleep and add or remove shrouds accordingly. Repeat for players marked 2 and 3. If all three players are now alive, add a shroud to all three.","The Al-Hadikhia chooses three players. <i class=""reminder-token""></i> <i class=""reminder-token""></i> <i class=""reminder-token""></i> Wake the player marked <b>1</b> and say ""the Al-Hadikhia has chosen"", then the player's name, then ""Do you choose to live?"" They either nod or shake their head. Put them to sleep and add or remove shrouds accordingly. Repeat for players marked <b>2</b> and <b>3</b>. If all three players are now alive, add a shroud to all three.","1,2,3,Chose death,Chose life","1,1,1,3,3",-1,41,demon,3,experimental,FALSE,1
amnesiac,Amnesiac,"You do not know what your ability is. Each day, privately guess what it is: you learn how accurate you are.",?,?,?,?,?,1,40,55,townsfolk,4,experimental,FALSE,1
angel,Angel,Something bad might happen to whoever is most responsible for the death of a new player.,"Announce which players are protected by the Angel. Add the ""Protected"" token to the relevant players.",Announce which players are protected by the Angel. Add the <b>Protected</b> token to the relevant players.,,,"Protect,Something Bad","-1,-1",1,-1,fabled,101,experimental,FALSE,1
apprentice,Apprentice,"On your 1st night, you gain a Townsfolk ability (if good), or a Minion ability (if evil).","Show the Apprentice the 'You are' card, then a Townsfolk or Minion token. In the Grimoire, replace the Apprentice token with that character token, and put the Apprentice's 'Is the Apprentice' reminder by that character token.","Show the Apprentice the <b>You are</b> card, then a Townsfolk or Minion token. In the Grimoire, replace the Apprentice token with that character token, and put the Apprentice's <b>Is the Apprentice</b> reminder by that character token.",,,Is the Apprentice,1,5,-1,traveler,100,experimental,FALSE,1
artist,Artist,"Once per game, during the day, privately ask the Storyteller any yes/no question.",,,,,No ability,1,-1,-1,townsfolk,5,snv,FALSE,1
assassin,Assassin,"Once per game, at night*, choose a player: they die, even if for some reason they could not.",,,The Assassin might choose a player.,"The Assassin might choose a player. <i class=""reminder-token""></i> <i class=""reminder-token""></i>","Dead,No ability","1,1",-1,44,minion,5,bmr,FALSE,1
atheist,Atheist,"The Storyteller can break the game rules & if executed, good wins, even if you are dead [No evil characters]",,,,,,,-1,-1,townsfolk,6,experimental,TRUE,1
balloonist,Balloonist,"Each night, you learn 1 player of each character type, until there are no more types to learn. [+1 Outsider]",Show any player,"Show any player <i class=""reminder-token""></i>",Show a player with a different character type to previously,"Show a player with a different character type to previously <i class=""reminder-token""></i>","Seen Townsfolk,Seen Outsider,Seen Minion,Seen Demon,Seen traveler","1,1,1,1,1",55,70,townsfolk,2,experimental,TRUE,1
barber,Barber,"If you died today or tonight, the Demon may choose 2 players (not another Demon) to swap characters.",,,"If the Barber died today or tonight, show the Demon the THIS CHARACTER SELECTED YOU & Barber tokens. If the Demon chose 2 players, wake one at a time. Show the YOU ARE token & their new character token.","If the Barber died today or tonight, show the Demon the <b>THIS CHARACTER SELECTED YOU</b> &amp; Barber tokens. If the Demon chose 2 players, wake one at a time. Show the <b>YOU ARE</b> token &amp; their new character token.",Haircuts tonight,1,-1,48,outsider,6,snv,FALSE,1
barista,Barista,"Each night, until dusk, 1) a player becomes sober, healthy and gets true info, or 2) their ability works twice. They learn which.","Choose a player, wake them and tell them which Barista power is affecting them. Treat them accordingly (sober/healthy/true info or activate their ability twice).","Choose a player. <i class=""reminder-token""></i> wake them and tell them which Barista power is affecting them. Treat them accordingly (sober/healthy/true info or activate their ability twice).","Choose a player, wake them and tell them which Barista power is affecting them. Treat them accordingly (sober/healthy/true info or activate their ability twice).","Choose a player. <i class=""reminder-token""></i> wake them and tell them which Barista power is affecting them. Treat them accordingly (sober/healthy/true info or activate their ability twice).","Sober & Healthy,Ability twice","1,1",6,3,traveler,100,experimental,FALSE,1
baron,Baron,There are extra Outsiders in play. [+2 Outsiders],,,,,,,-1,-1,minion,6,tb,TRUE,1
beggar,Beggar,"You must use a vote token to vote. Dead players may choose to give you theirs. If so, you learn their alignment. You are sober & healthy.",,,,,,,-1,-1,traveler,100,experimental,FALSE,1
bishop,Bishop,Only the Storyteller can nominate. At least 1 opposite player must be nominated each day.,,,,,"Nominate good,Nominate evil","1,1",-1,-1,traveler,100,experimental,FALSE,1
bonecollector,Bone Collector,"Once per game, at night, choose a dead player: they regain their ability until dusk.",,,"The Bone Collector either shakes their head no or points at any dead player. If they pointed at any dead player, put the Bone Collector's 'Has Ability' reminder by the chosen player's character token. (They may need to be woken tonight to use it.)","The Bone Collector either shakes their head no or points at any dead player. If they pointed at any dead player, put the Bone Collector's <b>Has Ability</b> reminder by the chosen player's character token. <i class=""reminder-token""></i> (They may need to be woken tonight to use it.)","No ability,Has ability","1,1",-1,4,traveler,100,experimental,FALSE,1
boomdandy,Boomdandy,"If you are executed, all but 3 players die. 1 minute later, the player with the most players pointing at them dies.",,,,,,,-1,-1,minion,6,experimental,FALSE,1
bootlegger,Bootlegger,This script has homebrew characters or rules.,,,,,,,-1,-1,fabled,101,experimental,FALSE,1
bountyhunter,Bounty Hunter,"You start knowing 1 evil player. If the player you know dies, you learn another evil player tonight. [1 Townsfolk is evil]",Point to the KNOWN player.,Point to the <b>KNOWN</b> player.,"If the KNOWN player died today or tonight, point to a new KNOWN player.","If the <b>KNOWN</b> player died today or tonight, point to a new <b>KNOWN</b> player.",Known,1,57,72,townsfolk,1,experimental,TRUE,1
buddhist,Buddhist,"For the first 2 minutes of each day, veteran players may not talk.",Declare which players are affected by the Buddhist.,Declare which players are affected by the Buddhist.,,,,,2,-1,fabled,101,experimental,FALSE,1
bureaucrat,Bureaucrat,"Each night, choose a player (not yourself): their vote counts as 3 votes tomorrow.",The Bureaucrat chooses a player.,"The Bureaucrat chooses a player. <i class=""reminder-token""></i>",The Bureaucrat chooses a player.,"The Bureaucrat chooses a player. <i class=""reminder-token""></i>",3 votes,1,7,5,traveler,100,experimental,FALSE,1
butcher,Butcher,"Each day, after the 1st execution, you may nominate again.",,,,,,,-1,-1,traveler,100,experimental,FALSE,1
butler,Butler,"Each night, choose a player (not yourself): tomorrow, you may only vote if they are voting too.",The Butler chooses a player.,"The Butler chooses a player. <i class=""reminder-token""></i>",The Butler chooses a player.,"The Butler chooses a player. <i class=""reminder-token""></i>",Master,1,47,75,outsider,2,tb,FALSE,1
cannibal,Cannibal,"You have the ability of the recently killed executee. If they are evil, you are poisoned until a good player dies by execution.",,,,,"Poisoned,Died today","1,1",-1,-1,townsfolk,6,experimental,FALSE,1
cerenovus,Cerenovus,"Each night, choose a player & a good character: they are “mad” they are this character tomorrow, or might be executed.","The Cerenovus chooses a player & a character. Put the Cerenovus to sleep. Wake the target. Show the THIS CHARACTER SELECTED YOU token, the Cerenovus token, then the madness-character token.","The Cerenovus chooses a player &amp; a character. <i class=""reminder-token""></i> Put the Cerenovus to sleep. Wake the target. Show the <b>THIS CHARACTER SELECTED YOU</b> token, the Cerenovus token, then the madness-character token.","The Cerenovus chooses a player & a character. Put the Cerenovus to sleep. Wake the target. Show the THIS CHARACTER SELECTED YOU token, the Cerenovus token, then the madness-character token.","The Cerenovus chooses a player &amp; a character. <i class=""reminder-token""></i> Put the Cerenovus to sleep. Wake the target. Show the <b>THIS CHARACTER SELECTED YOU</b> token, the Cerenovus token, then the madness-character token.",Mad,1,32,21,minion,2,snv,FALSE,1
chambermaid,Chambermaid,"Each night, choose 2 alive players (not yourself): you learn how many woke tonight due to their ability.",The Chambermaid chooses 2 living players. Give a finger signal.,The Chambermaid chooses 2 living players. Give a finger signal.,The Chambermaid chooses 2 living players. Give a finger signal.,The Chambermaid chooses 2 living players. Give a finger signal.,,,63,79,townsfolk,2,bmr,FALSE,1
chef,Chef,You start knowing how many pairs of evil players there are.,Give a finger signal.,Give a finger signal.,,,,,44,-1,townsfolk,1,tb,FALSE,1
choirboy,Choirboy,"If the Demon kills the King, you learn which player is the Demon. [+ the King]",,,"If the Demon killed the King, point to the Demon player.","If the Demon killed the King, point to the Demon player.",,,-1,52,townsfolk,6,experimental,TRUE,1
clockmaker,Clockmaker,You start knowing how many steps from the Demon to its nearest Minion.,Give a finger signal.,Give a finger signal.,,,,,49,-1,townsfolk,1,snv,FALSE,1
courtier,Courtier,"Once per game, at night, choose a character: they are drunk for 3 nights & 3 days.",The Courtier might choose a character,"The Courtier might choose a character <i class=""reminder-token""></i> <i class=""reminder-token""></i>",The Courtier might choose a character,"The Courtier might choose a character <i class=""reminder-token""></i> <i class=""reminder-token""></i>","Drunk 3,Drunk 2,Drunk 1,No ability","1,1,1,1",26,14,townsfolk,5,bmr,FALSE,1
cultleader,Cult Leader,"Each night, you become the alignment of an alive neighbour. If all good players choose to join your cult, your team wins.","The Cult Leader might change alignment. If so, show the YOU ARE info token and a thumbs up or down for their new alignment.","The Cult Leader might change alignment. If so, show the <b>YOU ARE</b> info token and a thumbs up or down for their new alignment.","The Cult Leader might change alignment. If so, show the YOU ARE info token and a thumbs up or down for their new alignment.","The Cult Leader might change alignment. If so, show the <b>YOU ARE</b> info token and a thumbs up or down for their new alignment.",,,59,74,townsfolk,2,experimental,FALSE,1
damsel,Damsel,"All Minions know you are in play. If a Minion publicly guesses you (once), your team loses.",Wake each Minion. Show the Damsel token. Put each Minion to sleep.,Wake each Minion. Show the Damsel token. Put each Minion to sleep.,"If the Damsel was chosen by the Huntsman, show them the YOU ARE info token and their new character token.","If the Damsel was chosen by the Huntsman, show them the <b>YOU ARE</b> info token and their new character token.",Guess used,1,39,54,outsider,6,experimental,FALSE,1
deviant,Deviant,"If you were funny today, you cannot die by exile.",,,,,,,-1,-1,traveler,100,experimental,FALSE,1
devilsadvocate,Devil's Advocate,"Each night, choose a living player (different to last night): if executed tomorrow, they don't die.",The Devil's Advocate chooses a living player.,"The Devil's Advocate chooses a living player. <i class=""reminder-token""></i>",The Devil's Advocate chooses a living player.,"The Devil's Advocate chooses a living player. <i class=""reminder-token""></i>",Survives execution,1,29,19,minion,2,bmr,FALSE,1
djinn,Djinn,Use the Djinn's special rule. All players know what it is.,,,,,,,-1,-1,fabled,101,experimental,FALSE,1
doomsayer,Doomsayer,"If 4 or more players live, each living player may publicly choose (once per game) that a player of their own alignment dies.",,,,,,,-1,-1,fabled,101,experimental,FALSE,1
dreamer,Dreamer,"Each night, choose a player (not yourself or travelers): you learn 1 good and 1 evil character, 1 of which is correct.","The Dreamer points to a player. Show 1 good & 1 evil character token, 1 of which is their character.","The Dreamer points to a player. Show 1 good &amp; 1 evil character token, 1 of which is their character.","The Dreamer points to a player. Show 1 good & 1 evil character token, 1 of which is their character.","The Dreamer points to a player. Show 1 good &amp; 1 evil character token, 1 of which is their character.",,,50,64,townsfolk,2,snv,FALSE,1
drunk,Drunk,"You do not know you are the Drunk. You think you are a Townsfolk character, but you are not.",,,,,Drunk,1,-1,-1,outsider,6,tb,TRUE,1
duchess,Duchess,"Each day, 3 players may choose to visit you. At night*, each visitor learns how many visitors are evil, but 1 gets false info.",,,"Wake each player marked ""Visitor"" or ""False Info"" one at a time. Show them the Duchess token, then fingers (1, 2, 3) equaling the number of evil players marked ""Visitor"" or, if you are waking the player marked ""False Info,"" show them any number of fingers except the number of evil players marked ""Visitor.""","Wake each player marked ""Visitor"" or ""False Info"" one at a time. Show them the Duchess token, then fingers (1, 2, 3) equaling the number of evil players marked ""Visitor"" or, if you are waking the player marked ""False Info,"" show them any number of fingers except the number of evil players marked ""Visitor.""","Visitor,False Info","3,1",-1,1,fabled,101,experimental,FALSE,1
empath,Empath,"Each night, you learn how many of your 2 alive neighbours are evil.",Give a finger signal.,Give a finger signal.,Give a finger signal.,Give a finger signal.,,,45,61,townsfolk,2,tb,FALSE,1
engineer,Engineer,"Once per game, at night, choose which Minions or which Demon is in play.","The Engineer might choose Minions or Demons. If they do: Put the Engineer to sleep. Wake a target, show them the YOU ARE token and their new character token, then put that target to sleep. Repeat for all players that changed characters.","The Engineer might choose Minions or Demons. <i class=""reminder-token""></i> If they do: Put the Engineer to sleep. Wake a target, show them the <b>YOU ARE</b> token and their new character token, then put that target to sleep. Repeat for all players that changed characters.","The Engineer might choose Minions or Demons. If they do: Put the Engineer to sleep. Wake a target, show them the YOU ARE token and their new character token, then put that target to sleep. Repeat for all players that changed characters.","The Engineer might choose Minions or Demons. <i class=""reminder-token""></i> If they do: Put the Engineer to sleep. Wake a target, show them the <b>YOU ARE</b> token and their new character token, then put that target to sleep. Repeat for all players that changed characters.",No ability,1,20,11,townsfolk,5,experimental,FALSE,1
eviltwin,Evil Twin,"You & an opposing player know each other. If the good player is executed, evil wins. Good can't win if you both live.",Wake both twins. Allow eye contact. Show the good twin's character token to the Evil Twin & vice versa.,Wake both twins. Allow eye contact. Show the good twin's character token to the Evil Twin &amp; vice versa.,,,Twin,1,30,-1,minion,6,snv,FALSE,1
exorcist,Exorcist,"Each night*, choose a player (different to last night): the Demon, if chosen, learns who you are then doesn't wake tonight.",,,The Exorcist chooses a player. Put the Exorcist to sleep. If the Exorcist chose the Demon: Wake the Demon. Show the THIS CHARACTER SELECTED YOU & Exorcist tokens. Point to the Exorcist.,"The Exorcist chooses a player. <i class=""reminder-token""></i> Put the Exorcist to sleep. If the Exorcist chose the Demon: Wake the Demon. Show the <b>THIS CHARACTER SELECTED YOU</b> &amp; Exorcist tokens. Point to the Exorcist.",Chosen,1,-1,28,townsfolk,3,bmr,FALSE,1
fanggu,Fang Gu,"Each night*, choose a player: they die. The 1st Outsider this kills becomes an evil Fang Gu & you die instead. [+1 Outsider]",,,The Fang Gu chooses a player. If they chose an Outsider (once only): Replace the Outsider token with the spare Fang Gu token. Put the Fang Gu to sleep. Wake the target. Show the YOU ARE and Fang Gu tokens & give a thumbs-down.,"The Fang Gu chooses a player. <i class=""reminder-token""></i> If they chose an Outsider (once only): Replace the Outsider token with the spare Fang Gu token. Put the Fang Gu to sleep. Wake the target. Show the <b>YOU ARE</b> and Fang Gu tokens &amp; give a thumbs-down. <i class=""reminder-token""></i>","Dead,Once","1,1",-1,36,demon,3,snv,TRUE,2
farmer,Farmer,"If you die at night, an alive good player becomes a Farmer.",,,"If the Farmer died tonight, wake an alive good player. Show them the YOU ARE info token and a Farmer character token. Replace their previous token with the Farmer token.","If the Farmer died tonight, wake an alive good player. Show them the <b>YOU ARE</b> info token and a Farmer character token. Replace their previous token with the Farmer token.",,,-1,56,townsfolk,6,experimental,FALSE,-1
fearmonger,Fearmonger,"Each night, choose a player. If you nominate & execute them, their team loses. All players know if you choose a new player.","The Fearmonger chooses a player. Declare that ""the Fearmonger has chosen a player.""","The Fearmonger chooses a player. <i class=""reminder-token""></i> Declare that ""the Fearmonger has chosen a player.""","The Fearmonger chooses a player. If the player wasn't already marked with the FEAR reminder, declare that ""the Fearmonger has chosen a player.""","The Fearmonger chooses a player. <i class=""reminder-token""></i> If the player wasn't already marked with the <b>FEAR</b> reminder, declare that ""the Fearmonger has chosen a player.""",Fear,1,33,23,minion,2,experimental,FALSE,1
ferryman,Ferryman,"On the final day, all dead players regain their vote token.",,,,,,,-1,-1,fabled,101,experimental,FALSE,1
fibbin,Fibbin,"Once per game, 1 good player might get false information.",,,,,Used,1,-1,-1,fabled,101,experimental,FALSE,1
fiddler,Fiddler,"Once per game, the Demon secretly chooses an opposing player: all players choose which of these 2 players win.",,,,,,,-1,-1,fabled,101,experimental,FALSE,1
fisherman,Fisherman,"Once per game, during the day, visit the Storyteller for some advice to help you win.",,,,,No ability,1,-1,-1,townsfolk,5,experimental,FALSE,1
flowergirl,Flowergirl,"Each night*, you learn if a Demon voted today.",,,Either nod or shake your head.,Either nod or shake your head.,"Demon voted,Demon not voted","1,1",-1,65,townsfolk,3,snv,FALSE,1
fool,Fool,"The first time you die, you don't.",,,,,No ability,1,-1,-1,townsfolk,6,bmr,FALSE,1
fortuneteller,Fortune Teller,"Each night, choose 2 players: you learn if either is a Demon. There is a good player that registers as a Demon to you.",The Fortune Teller chooses 2 players. Nod if either is the Demon (or the RED HERRING).,The Fortune Teller chooses 2 players. Nod if either is the Demon (or the <b>RED HERRING</b>).,The Fortune Teller chooses 2 players. Nod if either is the Demon (or the RED HERRING).,The Fortune Teller chooses 2 players. Nod if either is the Demon (or the <b>RED HERRING</b>).,Red herring,1,46,62,townsfolk,2,tb,FALSE,1
gambler,Gambler,"Each night*, choose a player & guess their character: if you guess wrong, you die.",,,The Gambler chooses a player & a character.,"The Gambler chooses a player &amp; a character. <i class=""reminder-token""></i>",Dead,1,-1,16,townsfolk,3,bmr,FALSE,1
gangster,Gangster,"Once per day, you may choose to kill an alive neighbour, if your other alive neighbour agrees.",,,,,,,-1,-1,traveler,100,experimental,FALSE,1
gardener,Gardener,The Storyteller assigns 1 or more players' characters.,,,,,,,-1,-1,fabled,101,experimental,FALSE,1
general,General,"Each night, you learn which alignment the Storyteller believes is winning: good, evil, or neither.",Give a thumb signal.,Give a thumb signal.,Give a thumb signal.,Give a thumb signal.,,,62,78,townsfolk,2,experimental,FALSE,1
goblin,Goblin,"If you publicly claim to be the Goblin when nominated & are executed that day, your team wins.",,,,,Claimed,1,-1,-1,minion,6,experimental,FALSE,1
godfather,Godfather,"You start knowing which Outsiders are in play. If 1 died today, choose a player tonight: they die. [−1 or +1 Outsider]",Show the character tokens of all in-play Outsiders.,Show the character tokens of all in-play Outsiders.,"If an Outsider died today, the Godfather chooses a player.","If an Outsider died today, the Godfather chooses a player. <i class=""reminder-token""></i>","Died today,Dead","1,1",28,45,minion,1,bmr,TRUE,1
golem,Golem,"You may only nominate once per game. When you do, if the nominee is not the Demon, they die.",,,,,Can not nominate,1,-1,-1,outsider,6,experimental,FALSE,1
goon,Goon,"Each night, the 1st player to choose you with their ability is drunk until dusk. You become their alignment.",,,,,Drunk,1,-1,-1,outsider,2,bmr,FALSE,1
gossip,Gossip,"Each day, you may make a public statement. Tonight, if it was true, a player dies.",,,"If the Gossip is due to kill a player, they die.","If the Gossip is due to kill a player, they die. <i class=""reminder-token""></i>",Dead,1,-1,46,townsfolk,4,bmr,FALSE,1
grandmother,Grandmother,"You start knowing a good player & their character. If the Demon kills them, you die too.",Point to the grandchild player & show their character token.,Point to the grandchild player &amp; show their character token.,"If the grandchild was killed by the Demon, the Grandmother dies too.","If the grandchild was killed by the Demon, the Grandmother dies too. <i class=""reminder-token""></i>",Grandchild,1,48,59,townsfolk,1,bmr,FALSE,1
gunslinger,Gunslinger,"Each day, after the 1st vote has been tallied, you may choose a player that voted: they die.",,,,,,,-1,-1,traveler,100,experimental,FALSE,1
harlot,Harlot,"Each night*, choose a living player: if they agree, you learn their character, but you both might die.",,,"The Harlot points at any player. Then, put the Harlot to sleep. Wake the chosen player, show them the 'This character selected you' token, then the Harlot token. That player either nods their head yes or shakes their head no. If they nodded their head yes, wake the Harlot and show them the chosen player's character token. Then, you may decide that both players die.","The Harlot points at any player. Then, put the Harlot to sleep. Wake the chosen player, show them the <b>This character selected you</b> token, then the Harlot token. That player either nods their head yes or shakes their head no. If they nodded their head yes, wake the Harlot and show them the chosen player's character token. Then, you may decide that both players die. <i class=""reminder-token""></i> <i class=""reminder-token""></i>",Dead,2,-1,6,traveler,100,experimental,FALSE,1
harpy,Harpy,"Each night, choose 2 players: tomorrow, the 1st player is mad that the 2nd is evil, or both might die.","The Harpy chooses two players. Put the Harpy to sleep. Wake the 1st target. Show the THIS CHARACTER SELECTED YOU token, the Harpy token, then point to the 2nd target.","The Harpy chooses two players. <i class=""reminder-token""></i> <i class=""reminder-token""></i> Put the Harpy to sleep. Wake the 1st target. Show the <b>THIS CHARACTER SELECTED YOU</b> token, the Harpy token, then point to the 2nd target.","The Harpy chooses two players. Put the Harpy to sleep. Wake the 1st target. Show the THIS CHARACTER SELECTED YOU token, the Harpy token, then point to the 2nd target.","The Harpy chooses two players. <i class=""reminder-token""></i> <i class=""reminder-token""></i> Put the Harpy to sleep. Wake the 1st target. Show the <b>THIS CHARACTER SELECTED YOU</b> token, the Harpy token, then point to the 2nd target.","Mad,2nd","1,1",34,24,minion,2,experimental,FALSE,1
hellslibrarian,Hell's Librarian,Something bad might happen to whoever talks when the Storyteller has asked for silence.,,,,,Something Bad,1,-1,-1,fabled,101,experimental,FALSE,1
heretic,Heretic,"Whoever wins, loses & whoever loses, wins, even if you are dead.",,,,,,,-1,-1,outsider,6,experimental,FALSE,1
highpriestess,High Priestess,"Each night, learn which player the Storyteller believes you should talk to most.
",Point to a player.,Point to a player.,Point to a player.,Point to a player.,,,61,77,townsfolk,2,experimental,FALSE,1
